deal,description,episode,category,entrepreneurs,location,website,askedFor,exchangeForStake,valuation,season,shark1,shark2,shark3,shark4,shark5,title,episode-season,Multiple Entreprenuers
FALSE,"Vurtego is a high-tech pogo stick that is super lightweight, ultra durable, and nearly silent. It provides the smoothest and highest performance pogo ride anywhere. Eschewing the traditional pogo stick spring, Vurtego's bounce comes from compressed air instead. Before hopping on, you simply pump it up using any bike pump or air compressor. The cylinder body is made of aircraft aluminum and the footpeg assembly locks the user's feet to the pogo stick securely during the bounce. Made in the USA, Vurtego comes fully assembled and ready to bounce you to new heights!",2,Toys and Games,Brian Spencer,"Mission Viejo, CA",http://www.vurtegopogo.com/,500000,20,2500000,2,Barbara Corcoran,Robert Herjavec,Kevin O'Leary,Daymond John,Mark Cuban,Vurtego,2-Feb,FALSE
FALSE,Rubber bands that increase the resistance in your exercise activities.,3,Fitness Apparel and Accessories,Stacy Erwin,"Overland Park, KS",http://www.fitnessstride.com,140000,15,933333,2,Barbara Corcoran,Robert Herjavec,Kevin O'Leary,Daymond John,Kevin Harrington,Fitness Stride,3-Feb,FALSE
TRUE,"Mod Mom Furniture is stylish, high-quality, made-to-order furniture for children's bedrooms and playrooms. These carefully crafted pieces are long-lasting, so they can serve your child over many years. The company was founded by the eponymous mom who was dissatisfied with the current offerings on the market, which were expensive and uninspired. Mod Mom Furniture sources eco-friendly materials, including sustainable and formaldehyde-free wood and varnishing products.",3,Furniture,Kiersten Hathcock,"Flagstaff, AZ",http://www.modmomfurniture.com/,90000,25,360000,2,Barbara Corcoran,Robert Herjavec,Kevin O'Leary,Daymond John,Kevin Harrington,Mod Mom Furniture,3-Feb,FALSE
TRUE,"FlipOutz are flexible silicon bracelets that can hold five coins of your choosing. Kids can personalize their Flip Outz with any five of numerous available choices. You can also swap out coins, trade them with friends, and even set up an online profile which lets you show off the coins you have and see where your traded coins have traveled over time.",3,Toys and Games,Emily Johnson,"Myrtle Beach, NC",http://www.flipoutz.com/,100000,20,500000,2,Barbara Corcoran,Robert Herjavec,Kevin O'Leary,Daymond John,Kevin Harrington,Flip Outz,3-Feb,FALSE
FALSE,"Pure Ayre Odor Eliminator is for anyone who owns pets or has ever faced off against lingering smells. What makes Pure Ayre different than other smell-neutralizing sprays is that it uses natural enzymes to break down the smelly compounds. Pure Ayre banishes bad odors without harsh chemicals, alcohol, bacteria, or citrus. It's effective on even the most offensive smells, for example vomit, skunk spray, and kennel odors. Once you buy your first 14 oz. or 22 oz. spray bottle of Pure Aure Odor Eliminator, you can buy it by the gallon and continue to reuse the bottle.",3,Storage and Cleaning Products,James Mitchell,"Kent, WA",http://www.pureayre.com/,150000,10,1500000,2,Barbara Corcoran,Robert Herjavec,Kevin O'Leary,Daymond John,Kevin Harrington,Pure Ayre,3-Feb,FALSE
TRUE,"A country-style apparel store sold through Sports Authority, truck stops and travel plazas.",4,Men and Women's Apparel,Mike Abbaticchio & Shon Lees,"Parkland, FL",http://www.hillbillybrand.com/,50000,25,200000,2,Barbara Corcoran,Robert Herjavec,Kevin O'Leary,Jeff Foxworthy,Daymond John,Hillbilly Brand,4-Feb,FALSE
TRUE,A children's seat attachable to luggage that instantly converts it into a travel stroller.,4,Baby and Child Care,Darryl and Randy Lenz,"Peachtree City, GA",http://www.rideoncarryon.com/,50000,25,200000,2,Barbara Corcoran,Robert Herjavec,Kevin O'Leary,Jeff Foxworthy,Daymond John,Ride-On Carry-On,4-Feb,TRUE
FALSE,Premium beef jerky made without additives or preservatives.,4,Specialty Food,Ken Howell,"Hope Mills, NC",http://unclezipsjerky.com/,25000,20,125000,2,Barbara Corcoran,Robert Herjavec,Kevin O'Leary,Jeff Foxworthy,Daymond John,Uncle Zip's Beef Jerky,4-Feb,FALSE
TRUE,A rubber band that works as a money clip.,4,Novelties,Johnny Gennaro & Vinny Pastore,"New York, NY",http://amzn.to/1AcWx1t,50000,20,250000,2,Barbara Corcoran,Robert Herjavec,Kevin O'Leary,Jeff Foxworthy,Daymond John,Broccoli Wad,4-Feb,FALSE
FALSE,An aromatic lip gloss designed to help curb appetite.,5,Personal Care and Cosmetics,April Morris,"Indianapolis, IN",,80000,20,400000,2,Barbara Corcoran,Robert Herjavec,Kevin O'Leary,Daymond John,Kevin Harrington,THINgloss,5-Feb,FALSE
TRUE,Light-up decals for car windows.,5,Automotive,George Podd and Rolf Schwartz,"Chicago, IL",http://powerdecal.com/,100000,5,2000000,2,Barbara Corcoran,Robert Herjavec,Kevin O'Leary,Daymond John,Kevin Harrington,Lightfilm,5-Feb,TRUE
FALSE,"Small cases for mints, gum and contact lenses featuring a clip that allows them to be attached to belts, backpacks, or other travel gear.",5,Novelties,Bob Kroupa,"Chicago, IL",http://clipngo.com/,500000,30,1666667,2,Barbara Corcoran,Robert Herjavec,Kevin O'Leary,Daymond John,Kevin Harrington,Clip'n'Go,5-Feb,FALSE
TRUE,A magnetic skin with a decorative finish that can be applied to any appliance.,5,Home Improvement,Jan Augenstein,"Dayton, OH",http://www.fridgefronts.com/,100000,30,333333,2,Barbara Corcoran,Robert Herjavec,Kevin O'Leary,Daymond John,Kevin Harrington,Fridge Fronts,5-Feb,FALSE
TRUE,A new kind of broom with a built-in scraper.,6,Storage and Cleaning Products,Shane Pannell,"Scottsdale, AZ",http://buysweepeasy.com/,40000,25,160000,2,Barbara Corcoran,Robert Herjavec,Kevin O'Leary,Daymond John,Kevin Harrington,Sweep Easy,6-Feb,FALSE
FALSE,"Accessories for casual golfers. The flagship product is the Par 6 cooler, which can keep a six-pack of beer stored in the shoe pocket of any golf bag.",6,Golf Products,Melissa and Ben Fossey,"Minnetonka, MN",,60000,20,300000,2,Barbara Corcoran,Robert Herjavec,Kevin O'Leary,Daymond John,Kevin Harrington,Caddy Swag,6-Feb,TRUE
TRUE,Cakes made from scratch from family recipes. They ship nationwide and orders can be placed online.,6,Specialty Food,Kim Nelson,"Greenville, SC",https://www.ilovedaisycakes.com/,50000,25,200000,2,Barbara Corcoran,Robert Herjavec,Kevin O'Leary,Daymond John,Kevin Harrington,Daisy Cakes,6-Feb,FALSE
FALSE,Designer hospital gowns for expecting moms.,6,Maternity,Deidrea Haysel,"Townsend, MD",http://www.hotmamagowns.com/,30000,20,150000,2,Barbara Corcoran,Robert Herjavec,Kevin O'Leary,Daymond John,Kevin Harrington,Hot Mama Gowns,6-Feb,FALSE
TRUE,"An impact-resistant hydration system that attaches to shoulder pads, aimed at football players in training.",7,Fitness Apparel and Accessories,Chris Spencer,"Houston, TX",http://www.hydromaxsystem.com/,50000,25,200000,2,Barbara Corcoran,Robert Herjavec,Kevin O'Leary,Jeff Foxworthy,Daymond John,Hydromax,7-Feb,FALSE
FALSE,A mobile entertainment company running specialized vehicles with movie theaters and video games.,7,Entertainment,Stuart and David Pikoff,"Austin, TX",http://www.g2u.com/,500000,10,5000000,2,Barbara Corcoran,Robert Herjavec,Kevin O'Leary,Jeff Foxworthy,Daymond John,Games2U,7-Feb,TRUE
FALSE,"A barf bag worn around the neck, for small children who are prone to carsickness.",7,Baby and Child Care,Les Cookson,"Sacramento, CA",http://www.carsikbib.com,30000,15,200000,2,Barbara Corcoran,Robert Herjavec,Kevin O'Leary,Jeff Foxworthy,Daymond John,Carsik Bib,7-Feb,FALSE
FALSE,A push mower marketed as a more eco-friendly alternative than powered mowers.,7,Gardening,Andy Humphrey,"Traverse City, MD",http://www.ecomowers.com/,90000,20,450000,2,Barbara Corcoran,Robert Herjavec,Kevin O'Leary,Jeff Foxworthy,Daymond John,Ecomowers,7-Feb,FALSE
FALSE,"A line of candles that come in ""manly"" scents of pot roast, golf course, football, popcorn and draft beer, among others.",8,Home Accessories,Johnson Bailey,"Broken Arrow, OK",,50000,25,200000,2,Barbara Corcoran,Robert Herjavec,Kevin O'Leary,Daymond John,Mark Cuban,Man Candle,8-Feb,FALSE
FALSE,Non-stick fabric aisle runners for wedding ceremonies and special events.,8,Weddings,Julie Goldman,"Montclair, NJ",http://www.originalrunners.com/,250000,15,1666667,2,Barbara Corcoran,Robert Herjavec,Kevin O'Leary,Daymond John,Mark Cuban,Original Runner Company,8-Feb,FALSE
TRUE,"The Rocket, the company's flagship product, can turn anything into a speaker through its vibrations.",8,Electronics,Jason Lucash and Michael Szymczak,"Costa Mesa, CA",http://www.origaudio.com,150000,15,1000000,2,Barbara Corcoran,Robert Herjavec,Kevin O'Leary,Daymond John,Mark Cuban,Origaudio,8-Feb,TRUE
TRUE,Hy-Conn is a super-fast connector for fire hydrants and garden hoses. The Pro Edition can be connected to any fire hydrant without the use of adapters or tools. The Home edition is for garden hoses.,8,Productivity Tools,Jeff Stroope,"Ashdown, AR",http://www.hy-conn.com/,500000,40,1250000,2,Barbara Corcoran,Robert Herjavec,Kevin O'Leary,Daymond John,Mark Cuban,Hy-Conn,8-Feb,FALSE
TRUE,"The patented CitiKitty Cat Toilet Training Kit uses a proven, disappearing litter box technique that has successfully toilet trained cats for decades. CitiKitty's specially-designed training seat fits ALL toilets and transitions cats of all age, size, and breed from litter box to toilet. Any healthy cat, three months of age or older that is successfully using a litter box is a candidate for toilet training.",9,Pet Products,Rebecca Rescate,"Morrisville, PA",http://www.citikitty.com/,100000,15,666667,2,Barbara Corcoran,Robert Herjavec,Kevin O'Leary,Daymond John,Kevin Harrington,CitiKitty,9-Feb,FALSE
FALSE,T-shirts for expectant moms that display the due date.,9,Women's Apparel,Kim Preis,"Chicago, IL",,50000,15,333333,2,Barbara Corcoran,Robert Herjavec,Kevin O'Leary,Daymond John,Kevin Harrington,Samson Martin,9-Feb,FALSE
TRUE,Shoes with interchangeable uppers allowing the user to easily vary their look.,9,Women's Shoes,Dominique McClain Barteet,"Palm Beach, FL",http://www.onesolestore.com/,500000,20,2500000,2,Barbara Corcoran,Robert Herjavec,Kevin O'Leary,Daymond John,Kevin Harrington,One Sole,9-Feb,FALSE
TRUE,Aldo Orta Jewelry makes fashion jewelry with a royal theme.,9,Women's Accessories,Aldo Orta,"Burbank, IL",http://www.aojewelry.com/,180000,45,400000,2,Barbara Corcoran,Robert Herjavec,Kevin O'Leary,Daymond John,Kevin Harrington,Aldo Orta Jewelry,9-Feb,FALSE
TRUE,A water container that unscrews from the bottom as well as the top for ease of cleaning.,1,Water Bottles,Dave Mayer,"Oakland, CA",http://www.cleanbottle.com/,60000,5,1200000,3,Barbara Corcoran,Robert Herjavec,Kevin O'Leary,Daymond John,Mark Cuban,The Clean Bottle,1-Mar,FALSE
TRUE,A website where people can pre-purchase a night out on the town without the fear of getting turned away from a venue.,1,Entertainment,Alashe Nelson,"Miami, FL",https://www.ezvip.com/,150000,15,1000000,3,Barbara Corcoran,Robert Herjavec,Kevin O'Leary,Daymond John,Mark Cuban,EZ VIP,1-Mar,FALSE
FALSE,Professional ghost-writing services company.,1,Professional Services,Michael Levin,"Irvine, CA",http://businessghost.com/,200000,10,2000000,3,Barbara Corcoran,Robert Herjavec,Kevin O'Leary,Daymond John,Mark Cuban,Business Ghost,1-Mar,FALSE
FALSE,Personalized services for planning your own funeral in advance. They have partnered with a large insurance company for a plan that gives people the opportunity to prepay for their funeral.,1,Consumer Services,Nancy Bush and Sue Kruskopf,"Minneapolis, MN",https://www.mywonderfullife.com/,100000,10,1000000,3,Barbara Corcoran,Robert Herjavec,Kevin O'Leary,Daymond John,Mark Cuban,My Wonderful Life,1-Mar,TRUE
TRUE,"An online service where people can buy made-to-order cartoon drawings of cats, which are posted to the website.",2,Online Services,Steve Gadlin,"Chicago, IL",http://iwanttodrawacatforyou.com/,10000,25,40000,3,Barbara Corcoran,Robert Herjavec,Kevin O'Leary,Daymond John,Mark Cuban,I Want to Draw a Cat for You,2-Mar,FALSE
FALSE,A system to teach how to make successful sales pitches and step-by-step guides on what to say to prospective customers.,2,Professional Services,Dave Greco,"Hamden, CT",http://thesalespreneur.com/,90000,40,225000,3,Barbara Corcoran,Robert Herjavec,Kevin O'Leary,Daymond John,Mark Cuban,Salespreneur,2-Mar,FALSE
FALSE,A cargo management system that can transform a pickup truck into a bigger cargo-carrying vehicle in about 30 seconds with racks that fold out of the back bed.,2,Automotive,Donny McCall,"Greensboro, NC",http://www.invisarack.com,100000,10,1000000,3,Barbara Corcoran,Robert Herjavec,Kevin O'Leary,Daymond John,Mark Cuban,Invis-A-Rack,2-Mar,FALSE
FALSE,Concept for a family-friendly magic show in Las Vegas.,2,Entertainment,Rick Smith,"Cleveland, OH",http://ricksmithjr.com/,1500000,20,7500000,3,Barbara Corcoran,Robert Herjavec,Kevin O'Leary,Daymond John,Mark Cuban,Rick Smith Jr. Vegas Magic Show,2-Mar,FALSE
TRUE,"Chord Buddy is a one-of-a-kind learning system for the guitar that gets you playing from day one. Attach these tabs to your acoustic or electric guitar (right-handed only, sorry!) and you're ready to make music. Chord Buddy basically turns your real-life guitar into one as easy to play as those in your favorite Rock Band or Guitar Hero games. One at a time, you remove hte tabs and learn to play the chords on your own. Using the included instruction book, songbook, and DVD with two-month lesson plan, you can learn over 100 songs on your own!",3,Music,Travis Perry,"Dothan, AL",http://www.chordbuddy.com/,125000,10,1250000,3,Barbara Corcoran,Robert Herjavec,Kevin O'Leary,Daymond John,Mark Cuban,Chord Buddy,3-Mar,FALSE
FALSE,"Liquid Money answers the question: what if I smelled like a million bucks, instead of just looking like it? Not literally though! That would be unfortunate. Liquid Money for Him is formulated to smell like success. The fragrance opens with a woodsy aroma that gives way to notes of citrus, rosemary, grass, and ocean breeze. The company was founded and is led by Pat McCarthy, a sales executive with experience at top enterprise software companies. Liquid Money's website even asserts the product is used at Microsoft, salesforce, and SAP. Not to forget the ladies, Liquid Money is also available in a women's formulation. All products come in a box packed with real shredded US dollar bills, just to really drive home the point!",3,Novelties,Pat McCarthy,"Miami, FL",http://www.liquidmoney.com/,100000,5,2000000,3,Barbara Corcoran,Robert Herjavec,Kevin O'Leary,Daymond John,Mark Cuban,Liquid Money,3-Mar,FALSE
FALSE,Attachable lighted patches for jean pockets.,3,Electronics,Kyle Rainey,"Emeryville, CA",http://www.taillightz.com/,50000,50,100000,3,Barbara Corcoran,Robert Herjavec,Kevin O'Leary,Daymond John,Mark Cuban,Tail Lightz,3-Mar,FALSE
TRUE,"You Smell Soap is luxurious without taking itself too seriously. Made natural ingredients like shea butter and olive oil, You Smell Soap is fragrant yet gentle and soothing on the skin. Made with shea butter and olive oil, these bars create an unmatched soft and creamy lather. You Smell Soap is naturally fragrant yet gentle and soothing on your skin. Each bar comes wrapped in its signature ""You Smell"" packaging that is vintage-inspired and truly conversation-sparking. You Smell Soap is vegan and free of parabens, phthalates, and gluten.",3,Personal Care and Cosmetics,Megan Cummins,"Austin, TX",http://www.yousmellsoap.com/,55000,20,275000,3,Barbara Corcoran,Robert Herjavec,Kevin O'Leary,Daymond John,Mark Cuban,You Smell Soap,3-Mar,FALSE
FALSE,A canine-friendly cake mix that is safe for dogs to eat.,4,Pet Products,Kelly Chaney,"Pittsburgh, PA",http://www.puppycake.com/,50000,25,200000,3,Lori Greiner,Robert Herjavec,Kevin O'Leary,Daymond John,Mark Cuban,Puppy Cake,4-Mar,FALSE
FALSE,A comfy outfit that combines a sweatshirt and a blanket.,4,Undergarments and Basics,Ivori Tennelle,"Los Angeles, CA",http://www.theswilt.com/,30000,35,85714,3,Lori Greiner,Robert Herjavec,Kevin O'Leary,Daymond John,Mark Cuban,The Swilt,4-Mar,FALSE
TRUE,Wine Balloon (now sold under the name Air Cork) A product that preserves wine inside any already-opened bottle. It works by inflating a balloon inside the bottle to crowd out the air and prevent it from being in contact with the wine.,4,Wine Accessories,Eric Corti,"Mason, OH",http://aircork.com/,40000,30,133333,3,Lori Greiner,Robert Herjavec,Kevin O'Leary,Daymond John,Mark Cuban,Wine Balloon,4-Mar,FALSE
TRUE,A towel that is designed like a poncho so that kids can change out of their wet bathing suits without anyone seeing.,4,Baby and Children's Apparel and Accessories,Shelly Ehler,"Orange County, CA",http://showno.com/,50000,25,200000,3,Lori Greiner,Robert Herjavec,Kevin O'Leary,Daymond John,Mark Cuban,Show No,4-Mar,FALSE
TRUE,"A water-resistant and, even better, racoon-resistant fabric cover for garbage bins of all sizes.",5,Storage and Cleaning Products,Kevin and Melissa Kiernan,"West Greenwich, RI",https://www.lastlid.com,40000,20,200000,3,Lori Greiner,Robert Herjavec,Kevin O'Leary,Daymond John,Mark Cuban,The Last Lid,5-Mar,TRUE
FALSE,A wedge-styled pillow specially designed for women with large breasts so they can lie on their stomachs comfortably,5,Novelties,Amanda Schlechter,"West Palm Beach, FL",,30000,25,120000,3,Lori Greiner,Robert Herjavec,Kevin O'Leary,Daymond John,Mark Cuban,Ledge Pillow,5-Mar,FALSE
TRUE,Designer whole-leaf teas and accessories.,5,Specialty Food,Steve Nakisher and Shane Talbott,"Emeryville, CA",http://talbottteas.com/,250000,20,1250000,3,Lori Greiner,Robert Herjavec,Kevin O'Leary,Daymond John,Mark Cuban,Talbott Teas,5-Mar,TRUE
TRUE,Adjustable necklaces and bracelets with interchangeable accents for kids and adults of all ages.,5,Baby and Children's Apparel and Accessories,"Maddie, Margot and Diane Bradshaw","Dallas, TX",http://www.snapcapsonline.com/,300000,15,2000000,3,Lori Greiner,Robert Herjavec,Kevin O'Leary,Daymond John,Mark Cuban,M3 Girl Designs,5-Mar,TRUE
FALSE,"Five-Minute Furniture is a system that allows for furniture that's easily assembled without hand tools, screws or bolts. Modular and customizable, the patented Five-Minute Furniture system comes in a variety of sizes, and allows users to built the furniture that best suits their living space. When not in use, it packs flat just as easily as it is assembled. Five-Minute Furniture was created by an architect who was inspired by a prefabricated bookshelf that caught his attention while he worked at a retail store.",6,Furniture,Jared Joyce,"Bozeman, MT",,250000,25,1000000,3,Lori Greiner,Robert Herjavec,Kevin O'Leary,Daymond John,Mark Cuban,Five-Minute Furniture,6-Mar,FALSE
TRUE,"The Painted Pretzel sells creative, gourmet chocolate-covered pretzel confections in brick-and-mortar retail stores and online. The business offers pretzel knots, pretzel rods, pretzel bark and and pretzel turtles in a variety of flavors and sizes, configured into bundles and samplers. The company has also expanded into corporate gifts, and they count numerous Fortune 500 companies among their customers. Since appearing on the show, The Painted Pretzel has also begun to do fundraising business. Organizations seeking to raise money can buy customized pretzels for resale towards their cause.",6,Specialty Food,Raven Thomas,"Scottsdale, AZ",http://www.thepaintedpretzel.com/,100000,25,400000,3,Lori Greiner,Robert Herjavec,Kevin O'Leary,Daymond John,Mark Cuban,The Painted Pretzel,6-Mar,FALSE
FALSE,"Esso Watches are ionized wristwatches that claim to improve your body's energy field. Now branded TAGI Gear, the company currently sells TAGI watches that are made of silicone and still claim to be equipped with negative ion technology, although such claims appear to have taken a backseat to the aesthetic appeal of the watches. There are two TAGI watch models: a digital version and an analog version. Both are water resistant and available in a number of fun color choices.",6,Homeopathic Remedies,Ryan Naylor,"Phoenix, AZ",,35000,20,175000,3,Lori Greiner,Robert Herjavec,Kevin O'Leary,Daymond John,Mark Cuban,Esso Watches,6-Mar,FALSE
TRUE,"ReadeREST is a magnetized clip that holds your eyewear when it's not in use. It works for reading glasses, sunglasses, and even some non-eyewear items that you might need to keep close at hand, like your work ID or maybe a pen. You can skip the granny chains and the lanyards and simply attach your ReadeREST to any shirt. The strong magnets will keep the clip securely in its place, while the V-shape provides a convenient resting place for those items that are always going astray.",6,Novelties,Rick Hopper,"Flower Mound, TX",http://www.readerest.com,150000,15,1000000,3,Lori Greiner,Robert Herjavec,Kevin O'Leary,Daymond John,Mark Cuban,ReadeREST,6-Mar,FALSE
FALSE,"Redirects the hot air from any home clothes dryer back into the house, rather than outside, where it helps keep the warmth during cold months.",7,Home Accessories,Lyle Schuette,"Derby, KS",https://www.heat-helper.com/,100000,50,200000,3,Barbara Corcoran,Robert Herjavec,Kevin O'Leary,Daymond John,Mark Cuban,The Heat Helper,7-Mar,FALSE
TRUE,"The Smart Baker is known for their insightfully helpful kitchen tools. The company is known for their collapsible cupcake stands, which display up to 100 cupcakes and stores flat when not in use. These cupcake stands are also adjustable, so you can adapt your configuration based on how many treats you plan to serve. The Smart Baker has also brought us pre-cut parchment paper, which you can purchase in round or rectangular shapes according to the molds you'll be using them in. These super helpful pre-cut sheets are outfitted with tabs that poke out the sides, which you can use to lift your cake out of the mold when done. You might also know The Smart Baker for their cheat sheet aprons, which are adorned with useful measuring and conversion tables. These aprons can save you from stains, spills, and measuring mistakes.",7,Kitchen Tools,Stephanie and Daniel Rensing,"Rockledge, FL",http://www.thesmartbaker.com/,75000,25,300000,3,Barbara Corcoran,Robert Herjavec,Kevin O'Leary,Daymond John,Mark Cuban,The Smart Baker,7-Mar,TRUE
FALSE,"ScotteVest stands for travel-ready apparel and accessories for men and women. The ScotteVest signature product feature is pockets, lots of pockets for storing and stashing essentials when you're on the go. ScotteVest takes pockets so seriously, in fact, that the number of pockets in each article is listed up front alongside the pricing in their online store. Although the company initially focused on vests, of course, its offerings have gradually expanded to include products such as hoodies, shirts, polos, hats, and even boxers. Overwhelmed by the options? The online store even has a ""Help Me Decide"" feature to make product comparisons easier.",7,Men and Women's Apparel,Scott Jordan,"Ketchum, ID",http://www.scottevest.com/,500000,15,3333333,3,Barbara Corcoran,Robert Herjavec,Kevin O'Leary,Daymond John,Mark Cuban,ScotteVest,7-Mar,FALSE
TRUE,"Kisstixx is a fun lip balm that comes in pairs according to compatible flavors. Each Kisstixx lipstick (try saying that three times fast) packs a punch of flavor, and they're paired to mix well when they come together in a kiss. Best of all, this lip balm keeps your lips protected and moisturized. Wear it every day to stay at your most kissable!",7,Personal Care and Cosmetics,Dallas Robinson and Mike Buonomo,"Orem, UT",http://kisstixx.com/,200000,20,1000000,3,Barbara Corcoran,Robert Herjavec,Kevin O'Leary,Daymond John,Mark Cuban,Kisstixx,7-Mar,TRUE
TRUE,"Nardo's Natural is a line of premium-quality organic skin care products proudly made in the USA. Their products range from facial care, to body care, to make-up, and even a line just for men. Always made with premium materials, you'll find things like coconut oil, shea butter, bentonite clay, acai berry and pomegranate among the ingredients. Just as important is what you won't find: all Nardo's Natural products are free of parabens, dyes, gluten or harsh chemicals. Nardo's Natural offers facial cleansers, anti-aging creams, make-up, body washes, exfoliants, moisturizers, and even after shave. The company also offers private label and contract manufacturing services for businesses and up-and-coming cosmetics businesses.",8,Personal Care and Cosmetics,"Kyle, KJ, Danny and DJ Nardo","Clearwater, FL",http://www.nardosnatural.com/,75000,12,625000,3,Barbara Corcoran,Robert Herjavec,Kevin O'Leary,Daymond John,Mark Cuban,Nardo's Natural,8-Mar,TRUE
TRUE,"Fashion-forward and edgy jewelry such as headpieces, body jewelry, and shoe jewelry.",8,Women's Accessories,Rachel Mann and Mackenzie Burdick,"San Francisco, CA",http://littersf.com/,80000,51,156863,3,Barbara Corcoran,Robert Herjavec,Kevin O'Leary,Daymond John,Mark Cuban,Litter,8-Mar,TRUE
FALSE,A mobile training device that simulates a basketball defender.,8,Fitness Equipment,Tony Devine,"Bristol, PA",http://www.theoriginalprofender.com/,75000,15,500000,3,Barbara Corcoran,Robert Herjavec,Kevin O'Leary,Daymond John,Mark Cuban,The Original Profender,8-Mar,FALSE
FALSE,A way to connect trustworthy senior citizens with customers seeking childcare and other household services.,8,Consumer Services,Todd Colby Pliss,"Los Angeles, CA",http://rentagrandma.com/,150000,20,750000,3,Barbara Corcoran,Robert Herjavec,Kevin O'Leary,Daymond John,Mark Cuban,Rent-A-Grandma,8-Mar,FALSE
FALSE,"A clear adhesive that lifts and repositions the skin to miminize sagging and cellulite, making thighs look firm and tight.",9,Personal Care and Cosmetics,Nick and Penilopee Larosa,"Tampa, FL",http://www.instantthighlift.com/,100000,25,400000,3,Barbara Corcoran,Robert Herjavec,Kevin O'Leary,Daymond John,Mark Cuban,Instant Thigh Lift,9-Mar,TRUE
